{
  "$schema": "https://json-schema.org/draft/2020-12/schema",
  "$id": "https://gorp.dev/specs/runtime/review-decision.schema.json",
  "title": "Gorp Review Decision",
  "description": "Wave D contract (retry added Sprint 5A). The single, immutable review decision for one run. Written exactly once by `gorp approve`, `gorp reject`, or `gorp retry`; never edited. 'approved' and 'rejected' are terminal for the node; 'retry' is terminal FOR THIS RUN ONLY — it returns the node to pending for a fresh attempt (new runId, new records) while this run's records and chain are retained unchanged. Linked to the gate record it judged by gateRecordSha256 and to the exact reviewed artifact by reviewedArtifactHash.",
  "type": "object",
  "additionalProperties": false,
  "required": [
    "schemaVersion",
    "graphId",
    "nodeId",
    "runId",
    "decision",
    "reviewer",
    "reason",
    "reviewedArtifactHash",
    "gateRecordSha256",
    "decidedAt"
  ],
  "properties": {
    "schemaVersion": { "type": "integer", "const": 1 },
    "graphId": { "$ref": "#/$defs/stableId" },
    "nodeId": { "$ref": "#/$defs/stableId" },
    "runId": { "$ref": "#/$defs/stableId" },
    "decision": { "type": "string", "enum": ["approved", "rejected", "retry"] },
    "reviewer": { "type": "string", "minLength": 1 },
    "reason": { "type": "string", "minLength": 1 },
    "reviewedArtifactHash": {
      "type": "string",
      "pattern": "^[0-9a-f]{40}$",
      "description": "The exact sandbox commit the reviewer judged. Must equal the gate record's validation.artifactHash."
    },
    "gateRecordSha256": {
      "type": "string",
      "pattern": "^[0-9a-f]{64}$",
      "description": "SHA-256 of the persisted gate-record file bytes at decision time. Binds the decision to the exact gate the reviewer saw."
    },
    "decidedAt": { "type": "string", "format": "date-time" }
  },
  "$defs": {
    "stableId": {
      "type": "string",
      "pattern": "^[A-Za-z0-9][A-Za-z0-9._-]{0,127}$"
    }
  }
}
